{
  "AWSTemplateFormatVersion": "2010-09-09",
  "Description": "CapacityProvider with intrinsic functions test",
  "Parameters": {
    "AllowedInstanceType": {
      "Default": "c5.xlarge",
      "Type": "String"
    },
    "Architecture": {
      "Default": "arm64",
      "Type": "String"
    },
    "ArchitecturesList": {
      "Default": "x86_64",
      "Type": "List<String>"
    },
    "CapacityProviderName": {
      "Default": "intrinsic-capacity-provider",
      "Type": "String"
    },
    "ExcludedInstanceTypeList": {
      "Default": "t2.micro, c5.xlarge",
      "Type": "List<String>"
    },
    "KmsKeyArn": {
      "Default": "arn:aws:kms:us-east-1:123456789012:key/abcd1234-ef56-gh78-ij90-klmnopqrstuv",
      "Type": "String"
    },
    "MaxVCpuCount": {
      "Default": 10,
      "Type": "Number"
    },
    "SecurityGroupId": {
      "Default": "sg-0a1e1457229da0f74",
      "Type": "String"
    },
    "SecurityGroupIdList": {
      "Default": "sg-0a1e1457229da0f74",
      "Type": "List<AWS::EC2::SecurityGroup::Id>"
    },
    "SubnetId": {
      "Default": "subnet-01e6344879fd06036",
      "Type": "String"
    },
    "SubnetIdList": {
      "Default": "subnet-01e6344879fd06036",
      "Type": "List<AWS::EC2::Subnet::Id>"
    },
    "TargetCPU": {
      "Default": 75.0,
      "Type": "Number"
    },
    "TargetMemory": {
      "Default": 81.2,
      "Type": "Number"
    }
  },
  "Resources": {
    "IntrinsicCapacityProvider": {
      "Properties": {
        "CapacityProviderName": {
          "Ref": "CapacityProviderName"
        },
        "CapacityProviderScalingConfig": {
          "MaxVCpuCount": {
            "Ref": "MaxVCpuCount"
          },
          "ScalingMode": "Manual",
          "ScalingPolicies": [
            {
              "PredefinedMetricType": "LambdaCapacityProviderAverageCPUUtilization",
              "TargetValue": {
                "Ref": "TargetCPU"
              }
            }
          ]
        },
        "InstanceRequirements": {
          "AllowedInstanceTypes": [
            {
              "Ref": "AllowedInstanceType"
            },
            {
              "Fn::Join": [
                ".",
                [
                  "c5",
                  "2xlarge"
                ]
              ]
            },
            "c5.large"
          ],
          "Architectures": [
            {
              "Ref": "Architecture"
            }
          ]
        },
        "KmsKeyArn": {
          "Ref": "KmsKeyArn"
        },
        "PermissionsConfig": {
          "CapacityProviderOperatorRoleArn": {
            "Fn::GetAtt": [
              "IntrinsicCapacityProviderOperatorRole",
              "Arn"
            ]
          }
        },
        "Tags": [
          {
            "Key": "Environment",
            "Value": {
              "Fn::Sub": "${AWS::StackName}-environment"
            }
          },
          {
            "Key": "Team",
            "Value": {
              "Fn::Sub": "${AWS::StackName}-team"
            }
          },
          {
            "Key": "lambda:createdBy",
            "Value": "SAM"
          }
        ],
        "VpcConfig": {
          "SecurityGroupIds": [
            {
              "Ref": "SecurityGroupId"
            }
          ],
          "SubnetIds": [
            {
              "Ref": "SubnetId"
            }
          ]
        }
      },
      "Type": "AWS::Lambda::CapacityProvider"
    },
    "IntrinsicCapacityProviderOperatorRole": {
      "Properties": {
        "AssumeRolePolicyDocument": {
          "Statement": [
            {
              "Action": [
                "sts:AssumeRole"
              ],
              "Effect": "Allow",
              "Principal": {
                "Service": [
                  "lambda.amazonaws.com"
                ]
              }
            }
          ],
          "Version": "2012-10-17"
        },
        "ManagedPolicyArns": [
          "arn:aws:iam::aws:policy/AWSLambdaManagedEC2ResourceOperator"
        ],
        "Tags": [
          {
            "Key": "lambda:createdBy",
            "Value": "SAM"
          }
        ]
      },
      "Type": "AWS::IAM::Role"
    },
    "IntrinsicCapacityProviderTwo": {
      "Properties": {
        "CapacityProviderScalingConfig": {
          "MaxVCpuCount": {
            "Ref": "MaxVCpuCount"
          },
          "ScalingMode": "Manual",
          "ScalingPolicies": [
            {
              "PredefinedMetricType": "LambdaCapacityProviderAverageCPUUtilization",
              "TargetValue": {
                "Ref": "TargetCPU"
              }
            }
          ]
        },
        "InstanceRequirements": {
          "Architectures": {
            "Ref": "ArchitecturesList"
          },
          "ExcludedInstanceTypes": {
            "Ref": "ExcludedInstanceTypeList"
          }
        },
        "KmsKeyArn": {
          "Ref": "KmsKeyArn"
        },
        "PermissionsConfig": {
          "CapacityProviderOperatorRoleArn": {
            "Fn::GetAtt": [
              "IntrinsicCapacityProviderTwoOperatorRole",
              "Arn"
            ]
          }
        },
        "Tags": [
          {
            "Key": "lambda:createdBy",
            "Value": "SAM"
          }
        ],
        "VpcConfig": {
          "SecurityGroupIds": {
            "Ref": "SecurityGroupIdList"
          },
          "SubnetIds": {
            "Ref": "SubnetIdList"
          }
        }
      },
      "Type": "AWS::Lambda::CapacityProvider"
    },
    "IntrinsicCapacityProviderTwoOperatorRole": {
      "Properties": {
        "AssumeRolePolicyDocument": {
          "Statement": [
            {
              "Action": [
                "sts:AssumeRole"
              ],
              "Effect": "Allow",
              "Principal": {
                "Service": [
                  "lambda.amazonaws.com"
                ]
              }
            }
          ],
          "Version": "2012-10-17"
        },
        "ManagedPolicyArns": [
          "arn:aws:iam::aws:policy/AWSLambdaManagedEC2ResourceOperator"
        ],
        "Tags": [
          {
            "Key": "lambda:createdBy",
            "Value": "SAM"
          }
        ]
      },
      "Type": "AWS::IAM::Role"
    }
  }
}
