{
  "AWSTemplateFormatVersion": "2010-09-09",
  "Description": "Test ManagedResourceTags - explicit tags configuration",
  "Parameters": {
    "Environment": {
      "Default": "Production",
      "Type": "String"
    }
  },
  "Resources": {
    "CpInheritsGlobal": {
      "Properties": {
        "PermissionsConfig": {
          "CapacityProviderOperatorRoleArn": {
            "Fn::GetAtt": [
              "CpInheritsGlobalOperatorRole",
              "Arn"
            ]
          }
        },
        "PropagateTags": {
          "ExplicitTags": [
            {
              "Key": "GlobalTag",
              "Value": "shared-value"
            }
          ],
          "Mode": "Explicit"
        },
        "Tags": [
          {
            "Key": "lambda:createdBy",
            "Value": "SAM"
          }
        ],
        "VpcConfig": {
          "SecurityGroupIds": [
            "sg-11111111"
          ],
          "SubnetIds": [
            "subnet-11111111"
          ]
        }
      },
      "Type": "AWS::Lambda::CapacityProvider"
    },
    "CpInheritsGlobalOperatorRole": {
      "Properties": {
        "AssumeRolePolicyDocument": {
          "Statement": [
            {
              "Action": [
                "sts:AssumeRole"
              ],
              "Effect": "Allow",
              "Principal": {
                "Service": [
                  "lambda.amazonaws.com"
                ]
              }
            }
          ],
          "Version": "2012-10-17"
        },
        "ManagedPolicyArns": [
          "arn:aws-us-gov:iam::aws:policy/AWSLambdaManagedEC2ResourceOperator"
        ],
        "Tags": [
          {
            "Key": "lambda:createdBy",
            "Value": "SAM"
          }
        ]
      },
      "Type": "AWS::IAM::Role"
    },
    "CpNoManagedResourceTags": {
      "Properties": {
        "PermissionsConfig": {
          "CapacityProviderOperatorRoleArn": {
            "Fn::GetAtt": [
              "CpNoManagedResourceTagsOperatorRole",
              "Arn"
            ]
          }
        },
        "PropagateTags": {
          "ExplicitTags": [
            {
              "Key": "GlobalTag",
              "Value": "shared-value"
            }
          ],
          "Mode": "Explicit"
        },
        "Tags": [
          {
            "Key": "lambda:createdBy",
            "Value": "SAM"
          }
        ],
        "VpcConfig": {
          "SecurityGroupIds": [
            "sg-33333333"
          ],
          "SubnetIds": [
            "subnet-33333333"
          ]
        }
      },
      "Type": "AWS::Lambda::CapacityProvider"
    },
    "CpNoManagedResourceTagsOperatorRole": {
      "Properties": {
        "AssumeRolePolicyDocument": {
          "Statement": [
            {
              "Action": [
                "sts:AssumeRole"
              ],
              "Effect": "Allow",
              "Principal": {
                "Service": [
                  "lambda.amazonaws.com"
                ]
              }
            }
          ],
          "Version": "2012-10-17"
        },
        "ManagedPolicyArns": [
          "arn:aws-us-gov:iam::aws:policy/AWSLambdaManagedEC2ResourceOperator"
        ],
        "Tags": [
          {
            "Key": "lambda:createdBy",
            "Value": "SAM"
          }
        ]
      },
      "Type": "AWS::IAM::Role"
    },
    "CpOverrideWithExplicitTags": {
      "Properties": {
        "PermissionsConfig": {
          "CapacityProviderOperatorRoleArn": {
            "Fn::GetAtt": [
              "CpOverrideWithExplicitTagsOperatorRole",
              "Arn"
            ]
          }
        },
        "PropagateTags": {
          "ExplicitTags": [
            {
              "Key": "GlobalTag",
              "Value": "shared-value"
            },
            {
              "Key": "Environment",
              "Value": {
                "Ref": "Environment"
              }
            },
            {
              "Key": "Team",
              "Value": {
                "Fn::Sub": "${AWS::StackName}-tooling"
              }
            }
          ],
          "Mode": "Explicit"
        },
        "Tags": [
          {
            "Key": "lambda:createdBy",
            "Value": "SAM"
          }
        ],
        "VpcConfig": {
          "SecurityGroupIds": [
            "sg-22222222"
          ],
          "SubnetIds": [
            "subnet-22222222"
          ]
        }
      },
      "Type": "AWS::Lambda::CapacityProvider"
    },
    "CpOverrideWithExplicitTagsOperatorRole": {
      "Properties": {
        "AssumeRolePolicyDocument": {
          "Statement": [
            {
              "Action": [
                "sts:AssumeRole"
              ],
              "Effect": "Allow",
              "Principal": {
                "Service": [
                  "lambda.amazonaws.com"
                ]
              }
            }
          ],
          "Version": "2012-10-17"
        },
        "ManagedPolicyArns": [
          "arn:aws-us-gov:iam::aws:policy/AWSLambdaManagedEC2ResourceOperator"
        ],
        "Tags": [
          {
            "Key": "lambda:createdBy",
            "Value": "SAM"
          }
        ]
      },
      "Type": "AWS::IAM::Role"
    }
  }
}
